{
  "format": "quickreplay-sequence/v1",
  "name": "Playground combo demo",
  "platform": "android",
  "repeat": 1,
  "loopDelayMs": 0,
  "parts": [
    {
      "repeat": 1,
      "script": {
        "format": "quickreplay/v1",
        "name": "A: three taps",
        "platform": "android",
        "screen": { "width": 1080, "height": 2400 },
        "steps": [
          { "type": "tap", "x": 300, "y": 1400, "delayBeforeMs": 300 },
          { "type": "tap", "x": 540, "y": 1400, "durationMs": 90, "delayBeforeMs": 300 },
          { "type": "tap", "x": 780, "y": 1400, "delayBeforeMs": 300 }
        ]
      }
    },
    {
      "repeat": 3,
      "script": {
        "format": "quickreplay/v1",
        "name": "B: swipe up",
        "platform": "android",
        "loopDelayMs": 200,
        "screen": { "width": 1080, "height": 2400 },
        "steps": [
          { "type": "swipe", "delayBeforeMs": 300,
            "points": [ { "x": 540, "y": 2050, "t": 0 }, { "x": 540, "y": 1500, "t": 300 } ] }
        ]
      }
    },
    {
      "repeat": 2,
      "delayBeforeMs": 500,
      "script": {
        "format": "quickreplay/v1",
        "name": "C: long press",
        "platform": "android",
        "screen": { "width": 1080, "height": 2400 },
        "steps": [
          { "type": "longPress", "x": 540, "y": 1750, "durationMs": 900, "delayBeforeMs": 300 }
        ]
      }
    }
  ]
}
